{
    "id": "course-page",
    "schema": "$(frameworkRoot)/pages/course-page/course-page.xsd",
    "transform": "$(frameworkRoot)/pages/course-page/transform.xslt",
    "styles": [],
    "scripts": [],
    "parameters": {
        "title": {
            "type": "string",
            "default": ""
        },
        "subtitle": {
            "type": "string",
            "default": ""
        },
        "image": {
            "type": "string",
            "default": ""
        },
        "background": {
            "type": "string",
            "default": "theme"
        },
        "toc": {
            "type": "boolean",
            "default": true
        },
        "page-numbered": {
            "type": "boolean",
            "default": false
        },
        "variant": {
            "type": "string",
            "default": "default"
        },
        "style-ref": {
            "type": "string",
            "default": ""
        }
    }
}
